[
  {
    "as_of": "2026-10-24",
    "category": "acousto-optics",
    "date": "2019",
    "date_precision": "year",
    "doi": "10.1038/s41586-019-1386-x",
    "first_author": "Arrangoiz-Arriola P.",
    "id": "acousto-optics-arrangoizarriola2019",
    "metric": "Phonon-number resolution (LN + qubit)",
    "platform": "LN + qubit",
    "provisional": true,
    "public": true,
    "value_text": "number splitting ~5x qubit linewidth",
    "values": [
      {
        "qualifier": "~",
        "quantity": "number splitting / qubit linewidth",
        "unit": "1",
        "value": 5
      }
    ],
    "venue": "Nature",
    "verification": "Y"
  },
  {
    "as_of": "2026-10-24",
    "category": "acousto-optics",
    "date": "2019",
    "date_precision": "year",
    "doi": "10.1364/OPTICA.6.000845",
    "first_author": "Jiang W.",
    "id": "acousto-optics-jiang2019",
    "metric": "LN optomechanical crystal",
    "platform": "LN",
    "provisional": true,
    "public": true,
    "value_text": "g0/2pi ~120 kHz; phonon lasing",
    "values": [
      {
        "qualifier": "~",
        "quantity": "g0/2pi",
        "unit": "kHz",
        "value": 120
      }
    ],
    "venue": "Optica 6, 845",
    "verification": "Y(arXiv)"
  },
  {
    "as_of": "2026-10-24",
    "category": "acousto-optics",
    "date": "2019",
    "date_precision": "year",
    "doi": "10.1049/el.2018.7297",
    "first_author": "Plessky V.",
    "id": "acousto-optics-plessky2019",
    "metric": "XBAR (laterally excited bulk acoustic resonator), first",
    "platform": "ZY-LN (400 nm film)",
    "provisional": true,
    "public": true,
    "value_text": "~4.8 GHz, 400 nm ZY-LN, coupling ~25%, Q ~300",
    "values": [
      {
        "qualifier": "~",
        "quantity": "resonance frequency",
        "unit": "GHz",
        "value": 4.8
      },
      {
        "qualifier": "=",
        "quantity": "film thickness",
        "unit": "nm",
        "value": 400
      },
      {
        "qualifier": "~",
        "quantity": "coupling",
        "unit": "%",
        "value": 25
      },
      {
        "qualifier": "~",
        "quantity": "Q",
        "unit": "1",
        "value": 300
      }
    ],
    "venue": "Electron. Lett. 55, 98",
    "verification": "Y"
  },
  {
    "as_of": "2026-10-24",
    "category": "acousto-optics",
    "date": "2020",
    "date_precision": "year",
    "doi": "10.1063/5.0012288",
    "first_author": "Sarabalis C.J.",
    "id": "acousto-optics-sarabalis2020",
    "metric": "AO modulator, LN on sapphire",
    "platform": "LN on sapphire",
    "provisional": true,
    "public": true,
    "value_text": "first unsuspended devices",
    "venue": "APL Photonics",
    "verification": "Y"
  },
  {
    "as_of": "2026-10-24",
    "category": "acousto-optics",
    "date": "2021",
    "date_precision": "year",
    "doi": "10.1364/OPTICA.413401",
    "first_author": "Sarabalis C.J.",
    "id": "acousto-optics-sarabalis2021",
    "metric": "AO, wavelength-scale waveguide",
    "notes": "Ver.: Y (qual.).",
    "platform": "TFLN",
    "provisional": true,
    "public": true,
    "value_text": "FoM improved by orders of magnitude (no number in abstract)",
    "venue": "Optica",
    "verification": "Y"
  },
  {
    "as_of": "2026-10-24",
    "category": "acousto-optics",
    "date": "2022",
    "date_precision": "year",
    "doi": "10.1038/s41377-022-00840-6",
    "first_author": "Wan L.",
    "highest_found": true,
    "id": "acousto-optics-wan2022",
    "metric": "AO modulator VpiL, lowest found",
    "platform": "TFLN + chalcogenide",
    "provisional": true,
    "public": true,
    "value_text": "0.03 V cm, TFLN + chalcogenide, unsuspended",
    "values": [
      {
        "qualifier": "=",
        "quantity": "VpiL",
        "unit": "V.cm",
        "value": 0.03
      }
    ],
    "venue": "Light Sci. Appl.",
    "verification": "Y"
  },
  {
    "as_of": "2026-10-24",
    "category": "acousto-optics",
    "date": "2022",
    "date_precision": "year",
    "doi": "10.1038/s41586-022-04500-y",
    "first_author": "Wollack E.A.",
    "id": "acousto-optics-wollack2022",
    "metric": "Entangled mechanical resonators (LN)",
    "platform": "LN",
    "provisional": true,
    "public": true,
    "value_text": "state tomography",
    "venue": "Nature",
    "verification": "Y"
  },
  {
    "as_of": "2026-10-24",
    "category": "eo-comb",
    "date": "2019",
    "date_precision": "year",
    "doi": "10.1038/s41586-019-1008-7",
    "first_author": "Zhang M.",
    "id": "eo-comb-zhang2019",
    "metric": "Resonant EO comb",
    "notes": "Ver.: Y (coordinator re-read abstract). \"80 nm\" not in abstract.",
    "platform": "TFLN",
    "provisional": true,
    "public": true,
    "value_text": ">900 lines at ~10 GHz, wider than L-band; spacing tunable 10 Hz to 100 MHz",
    "values": [
      {
        "qualifier": ">",
        "quantity": "comb lines",
        "unit": "1",
        "value": 900
      },
      {
        "qualifier": "~",
        "quantity": "line spacing",
        "unit": "GHz",
        "value": 10
      },
      {
        "qualifier": "=",
        "quantity": "spacing tuning min",
        "unit": "Hz",
        "value": 10
      },
      {
        "qualifier": "=",
        "quantity": "spacing tuning max",
        "unit": "MHz",
        "value": 100
      }
    ],
    "venue": "Nature 568, 373",
    "verification": "Y"
  },
  {
    "as_of": "2026-10-24",
    "category": "eo-comb",
    "date": "2020",
    "date_precision": "year",
    "doi": "10.1364/OE.397138",
    "first_author": "Shao L.",
    "id": "eo-comb-shao2020",
    "metric": "AO frequency shifter",
    "platform": "TFLN",
    "provisional": true,
    "public": true,
    "value_text": "3 GHz, >30 dB carrier suppression",
    "values": [
      {
        "qualifier": "=",
        "quantity": "frequency shift",
        "unit": "GHz",
        "value": 3
      },
      {
        "qualifier": ">",
        "quantity": "carrier suppression",
        "unit": "dB",
        "value": 30
      }
    ],
    "venue": "Opt. Express",
    "verification": "Y"
  },
  {
    "as_of": "2026-10-24",
    "category": "eo-comb",
    "date": "2021",
    "date_precision": "year",
    "doi": "10.1038/s41586-021-03999-x",
    "first_author": "Hu Y.",
    "id": "eo-comb-hu2021",
    "metric": "EO frequency shifter",
    "notes": "Ver.: Y (coordinator re-read abstract; arXiv v1 said ~99%).",
    "platform": "TFLN",
    "provisional": true,
    "public": true,
    "value_text": "Up to 28 GHz at ~90% on-chip efficiency; cascaded 119.2 GHz from 29.8 GHz drive",
    "values": [
      {
        "note": "stated as 'up to'",
        "qualifier": "=",
        "quantity": "frequency shift",
        "unit": "GHz",
        "value": 28
      },
      {
        "qualifier": "~",
        "quantity": "on-chip efficiency",
        "unit": "%",
        "value": 90
      },
      {
        "qualifier": "=",
        "quantity": "cascaded frequency shift",
        "unit": "GHz",
        "value": 119.2
      },
      {
        "qualifier": "=",
        "quantity": "drive frequency",
        "unit": "GHz",
        "value": 29.8
      }
    ],
    "venue": "Nature 599, 587",
    "verification": "Y"
  },
  {
    "as_of": "2026-10-24",
    "category": "eo-comb",
    "date": "2022",
    "date_precision": "year",
    "doi": "10.1038/s41566-022-01059-y",
    "first_author": "Hu Y.",
    "id": "eo-comb-hu2022",
    "metric": "Coupled-ring EO comb",
    "platform": "TFLN",
    "provisional": true,
    "public": true,
    "value_text": "30% efficiency, 132 nm span, 336 fs",
    "values": [
      {
        "qualifier": "=",
        "quantity": "conversion efficiency",
        "unit": "%",
        "value": 30
      },
      {
        "qualifier": "=",
        "quantity": "comb span",
        "unit": "nm",
        "value": 132
      },
      {
        "qualifier": "=",
        "quantity": "pulse width",
        "unit": "fs",
        "value": 336
      }
    ],
    "venue": "Nat. Photonics",
    "verification": "Y(arXiv)"
  },
  {
    "as_of": "2026-10-24",
    "category": "eo-comb",
    "date": "2022",
    "date_precision": "year",
    "doi": "10.1038/s41586-022-05345-1",
    "first_author": "Yu M.",
    "id": "eo-comb-yu2022",
    "metric": "Time-lens pulse generator",
    "platform": "TFLN",
    "provisional": true,
    "public": true,
    "value_text": "520 fs, 30 GHz, 0.54 pJ",
    "values": [
      {
        "qualifier": "=",
        "quantity": "pulse width",
        "unit": "fs",
        "value": 520
      },
      {
        "qualifier": "=",
        "quantity": "repetition rate",
        "unit": "GHz",
        "value": 30
      },
      {
        "qualifier": "=",
        "quantity": "pulse energy",
        "unit": "pJ",
        "value": 0.54
      }
    ],
    "venue": "Nature",
    "verification": "Y"
  },
  {
    "as_of": "2026-10-24",
    "category": "eo-comb",
    "date": "2023",
    "date_precision": "year",
    "doi": "10.1038/s42005-023-01137-9",
    "first_author": "Zhang K.",
    "id": "eo-comb-zhang2023",
    "metric": "Non-resonant EO comb",
    "platform": "TFLN",
    "provisional": true,
    "public": true,
    "value_text": "47 lines at 25 GHz",
    "values": [
      {
        "qualifier": "=",
        "quantity": "comb lines",
        "unit": "1",
        "value": 47
      },
      {
        "qualifier": "=",
        "quantity": "line spacing",
        "unit": "GHz",
        "value": 25
      }
    ],
    "venue": "Commun. Phys.",
    "verification": "Y"
  },
  {
    "as_of": "2026-10-24",
    "category": "eo-comb",
    "date": "2025",
    "date_precision": "year",
    "doi": "10.1038/s41586-024-08354-4",
    "first_author": "Zhang J.",
    "highest_found": true,
    "id": "eo-comb-zhang2025-tflt",
    "metric": "Widest integrated EO comb found (TFLT, not LN)",
    "platform": "TFLT",
    "provisional": true,
    "public": true,
    "value_text": ">450 nm (>60 THz), >2000 lines, triply resonant",
    "values": [